{
  "schema_version": "experiment.registration.v2",
  "experiment_id": "2099-01-01_replace-with-stable-slug",
  "registered_at": "2099-01-01T00:00:00Z",
  "natural_case_admission": false,
  "consumer": {
    "organ": "replace-with-consumer",
    "use": "Describe the reviewed downstream decision that will use the result.",
    "relationship": "external",
    "commitment": {
      "status": "confirmed",
      "evidence_ref": "replace-with-external-source:consumer-commitment",
      "confirmed_at": "2099-01-01T00:00:00Z",
      "valid_until": "2099-04-01T00:00:00Z"
    }
  },
  "decision_target": {
    "question": "Which concrete decision will this experiment inform?",
    "owner": "replace-with-decision-owner",
    "decision_ref": "replace-with-external-source:decision-target"
  },
  "intervention": {
    "name": "replace-with-intervention",
    "description": "Describe the one change that differs between control and treatment."
  },
  "control_condition": {
    "id": "control",
    "description": "Describe the baseline workflow without the intervention."
  },
  "treatment_condition": {
    "id": "treatment",
    "description": "Describe the workflow with the intervention and no other intended change."
  },
  "measurement": {
    "primary_metric": "replace-with-primary-metric",
    "direction": "lower_is_better",
    "unit": "count",
    "minimum_material_effect": 1,
    "method": "Describe how the metric is captured from evidence-bound observations.",
    "success": "Define the material success threshold.",
    "falsification": "Define the harmful or no-effect threshold.",
    "outcome_criteria": {
      "success_threshold": 0,
      "harm_or_falsification_threshold": 1
    },
    "cost_metric": {
      "id": "review_effort_seconds",
      "unit": "seconds",
      "method": "Measure total elapsed handling effort from condition preparation until the decision and scorecard are sealed, including evaluator report generation when applicable."
    }
  },
  "comparison": {
    "mode": "paired",
    "unit": "same task class, risk and context band",
    "minimum_control": 3,
    "minimum_treatment": 3,
    "comparability_constraints": [
      "same task class",
      "same risk level",
      "same context-size band"
    ],
    "confounders": [
      "operator familiarity",
      "repository drift"
    ]
  },
  "evidence_sources": {
    "allowed": [
      "typed execution receipt",
      "CI result",
      "diff-bound review",
      "operator decision record"
    ],
    "independent_observation_required": true
  },
  "review_at": "2099-03-01T00:00:00Z",
  "expires_at": "2099-04-01T00:00:00Z",
  "closure": {
    "allowed_outcomes": [
      "promote",
      "pilot",
      "defer",
      "reject",
      "archive"
    ],
    "archive_path": "experiments/_archive/2099-01-01_replace-with-stable-slug",
    "outcome_by_result": {
      "success": "promote",
      "harm_or_falsification": "reject",
      "inconclusive": "defer",
      "expired": "archive"
    }
  },
  "surface_budget": {
    "durable_additions": [],
    "durable_offsets": [],
    "reviewed_exception": null
  },
  "boundary": {
    "experiment_only": true,
    "no_auto_policy": true,
    "no_auto_routing": true,
    "no_queue_authority": true,
    "no_runtime_authority": true,
    "no_merge_authority": true
  }
}
